<?xml version="1.0" encoding="UTF-8"?>
<zahtev xmlns="https://github.com/djordjeognjenovic97/XML-projekat/zahtevcir"
 xmlns:xsi="http://www.w3.org/2001/XMLSchema-instance"
 xsi:schemaLocation="https://github.com/djordjeognjenovic97/XML-projekat/zahtevcir file:/C:/Users/TehnoCentar/Desktop/XML-projekat/portal%20sluzbenika/sluzbenik/src/main/resources/zahtevcir.xsd" mesto="mesto1" datum="2006-05-04" id="id1" stanje="podnet">
    <naziv>naziv0</naziv>
    <organ>
        <naziv>naziv1</naziv>
        <sediste>sediste0</sediste>
    </organ>
    <sadrzaj>
        <tipovi_zahteva>
            <obavestenje_posedovanje>da</obavestenje_posedovanje>
            <uvid_dokument>da</uvid_dokument>
            <kopija_dokument>da</kopija_dokument>
            <dostavljanje_kopije>
                <posta>da</posta>
            </dostavljanje_kopije>
        </tipovi_zahteva>
        <opis_informacije>opis_informacije0</opis_informacije>
    </sadrzaj>
    <trazilac_informacije email="email1">
        <pravno_lice>
            <naziv>naziv2</naziv>
        </pravno_lice>
        <adresa>
            <mesto>mesto0</mesto>
            <ulica>ulica0</ulica>
            <br_ulice>50</br_ulice>
        </adresa>
        <drugi_kontakt_podaci>drugi_kontakt_podaci0</drugi_kontakt_podaci>
    </trazilac_informacije>
</zahtev>
