<?xml version="1.0" encoding="UTF-8"?>
<zahtev xmlns="https://github.com/djordjeognjenovic97/XML-projekat"
 xmlns:xsi="http://www.w3.org/2001/XMLSchema-instance"
 xsi:schemaLocation="https://github.com/djordjeognjenovic97/XML-projekat file:/C:/Users/TehnoCentar/Desktop/zahtevcir.xsd" mesto="mesto1" datum="2006-05-04" id="id1" stanje="podnet">
    <naziv>Z A H T E V za pristup informaciji od javnog znaƒçaja</naziv>
    <organ>
        <naziv>naziv0</naziv>
        <sediste>sediste0</sediste>
    </organ>
    <sadrzaj>
        <tipovi_zahteva>
            <dostavljanje_kopije>
            </dostavljanje_kopije>
        </tipovi_zahteva>
        <opis_informacije>opis_informacije0</opis_informacije>
    </sadrzaj>
    <trazilac_informacije>
        <ime>ime0</ime>
        <prezime>prezime0</prezime>
        <adresa>
            <mesto>mesto0</mesto>
            <ulica>ulica0</ulica>
            <br_ulice>50</br_ulice>
        </adresa>
        <drugi_kontakt_podaci>drugi_kontakt_podaci0</drugi_kontakt_podaci>
    </trazilac_informacije>
</zahtev>
